content,score
Егов Ваш неадекватный . автор вы конкретно игнорируете указания Президента страны. Прошу Вас исправить все проблемы на этом сайте. Невозможно зайти и получить нужные справки.,5
"Просто, легко, удобно и быстро. Спасибо.",5
Меня все устраивает. Отличное приложения,5
Отличное приложение! Позволяет использовать время рационально!,5
Удобно и быстро обрабатывает все доступные информации,5
"Легко установить, легко работать! Все предельно ясно.",5
"Всё работает,не надо в очереди стоять,много преимуществ.",5
"Долго запрягаем, зато потом быстро едем. Долго не мог зарегистрироваться, но потом все как по маслу.",5
"спасибо , очень удобное приложение, не нужно ждать в очередях",5
Отличное приложение. Пользуюсь постоянно.,5
"Приложение еще новое, понравилось что вход быстрый.",5
"Все работает, раньше не открывал эл.паспорта, теперь открывает)",5
Всё работает но нет справкий с туб диспансера,5
В любой момент можно и удостоверение и т.д. документы можно показать. Где запрашивают документы.,5
Ошибка программы Почему то нельзя выбрать ребенка или супругу в справке об отсутствии недвижимости. Добавьте.,5
Работает все чётко. Скачал все справки не выходя из дома.,5
Раньше было хорошо через смс. А сейчас не могу зайти. Просить видео авторизации. Это не удобно народу,5
Нравиться доступ к справкам. Не теряеешь время напрасно.,5
Удобно брать справки и то что документы отражаются,5
Отличная программа. Спасибо разработчики. Удачного нового года.,5
"Скачал, все работает, только не могу понять, чем отличается от ""зелененького"".",5
Мне очень нравится приложение! Не выходя из дома можно все заказать!,5
Отличное приложение 👍. Быстро и удобно!,5
"Всё работает отлично. Спасибо за приложение, все документы под рукой👍👍👍",5
"За время карантина улучшили доступ к услугам, молодцы. Давно бы так...",5
Очень удобно и выходить стоять в очередях не нужно,5
Очень удобное приложение все так быстро работает!,5
Не хватает получения уведомления о выполнении услуги или поступления входящих документов в личном кабинете.,5
Классное приложение. Все доступно и быстро,5
"Пользовался раньше, удобно.Нечаяно удалил, теперь не могу подключиться.",5
"Всё хорошо, только разберитесь пожалуйста с регистрацией (фотоконтроль) с трудом прошёл эту стадию)",5
"Замечательное приложение, быстро получаешь необходимую информацию",5
Удобно. Не выходя из дома можно просмотреть важные доки и анализы,5
Не смогла зайти. Выходит ошибки при входе на сайт,5
"Удобное приложение, все документы под рукой. Паспорт вакцинации получен в тот же день после второй прививки.",5
"Великолепно. Есть много минусов, но целом неплохо",5
"Здравствуйте в строке семьи не всю семью выделены наверное строки мало , добавьте пожалуйста , потому что у некоторых семьях даже больше 10 детей , спасибо за понимание Вообще читают ли создатели приложение наши просьбы",5
Регистрация только по ЭЦП ! По SMS не проходит.,5
Очень удобно приложение по услугами,5
Пачему не получается зайти и не приходит смс с кодом и кагда предложение будет работат,5
"Здравствуйте, скачали приложение с Моей маркет, как установить русский язык, все приложение на английском",5
Удобно. Современно. Интерактивно.,5
Добавьте пожалуйста персональный кредитный отсчёт что бы можно посмотреть в приложении,5
Очень удобное и полезное приложение. Наконец-то!!,5
"Получил все необходимые справки онлайн, очень удобно!",5
"Все удобно и быстро, рахмет",5
Почему не могу увидеть очередь на жилье мгове хорошо было этот вообще не пойму что проще было мобильная версия было щас что чертиче и моя почта не верно совсем не моя почтовая адрес,5
"Хорошее приложение, очень удобно для получения справок!",5
Почему только не пойму у меня в электронных документах показывает старое удостоверение.А я поменял его полтора месяца назад.🙄,5
Цифровые документы не могу открыть. Загрузка идёт но не отражается.,5
"Для авторизации должно прийти смс , смски не приходят!!!!",5
Отличное приложение неудачники только не могут пройти регистрацию ведь это так легко 😄,5
Всё отлично. Хорошо и быстро загружается !!!,5
Хорошее приложение. Главное вникнуть и никаких проблем!,5
Быстро и удобно. Рахмет,5
"Просто, оперативно, качественно",5
"Верните старую версию это просто ужас, ничего не понятно и многих услуг нет",5
"Отличное приложение, очень удобно пользоваться.",5
"Удобно, легче и быстрее",5
Все понятно и очень удобно. Не пришлось ехать в Цон за эцп,5
"Все работает, иногда надо обновить страницу. Заходил по номеру телефона",5
Спасибо за удобное приложение. Хоть в очереди не надо сидеть в ЦОНе,5
Спасибо! Отличное приложение! За 2 секунды сразу установила!,5
"Быстро удобно, спосибо Вам.",5
"Все ок, правда иногда виснет.",5
Понравилось авторизация через отпечаток пальца!,5
Удачи в развитие и улучшение приложения. Работы предстоит еще много.,5
"Два дня ,заканчиваю толку нет ужас не загружается подождите вот и весь ответ",5
"После обновления перестал работать, сбрасывает.",5
Очень удобно получить государственные услуги в режиме онлайн.,5
"👍удобное приложение, теперь не обязательно иметь компьютер в доме.",5
"Все понятно и доступно ,спасибо.",5
все понятно и просто.супер приложение.,5
Отличное приложение ! Экономит время!,5
"Паспорт вакцинации без даты, нету qr-кода, как понять, не могу получить справки, исправьте, долго грузится",5
Очень удобно все справки в телефоне,5
После обновления приложение не хочет работать,5
"Очень удобное приложение, особенно для мобильных людей)",5
Почему на тел.Redmi 5A не скочаевается В чем причин удалил некоторые приложение но почему-то нет как скочать приложение как быстро получать ответы,5
"Класс ,быстро и удобно .",5
"Все работает, классное приложения👍",5
"Офигеть, получил полный отчёт по пенсионным накоплениям без лишнего гемора👍🏽👍🏽👍🏽",5
Полезная вещь реально экономит время и нервы,5
Очень удобно и самое главное мобильно,5
"Почему на официальном портале egov.kz не получается зарегистрироваться, то есть кнопка регистрации вообще никак не реагирует, писала на почту самому egov, но ответа нет",5
"Все удобно и просто,спасибо",5
Отличное приложение все справки не выходя из дома получила,5
Хорошо спасибо за такую интересную модернизацию цифровизацию,5
"Ошибки исправили, пока все гуд",5
Оперативно быстро. Класс,5
Супер.все удобно и понятно,5
"Здравствуйте! Не могу авторизоваться, уже второй день! Смс код не приходит! Номер прикреплён к ИИН! Номер включён! Как быть?",5
"Обращалась в Акимат гор.Нур-Султан, с жалобой о том что приходят извещения с налоговой об оплате за не существующее авто, которое было продано аж 2003 году, жалобу удовлетворили, хотя и не сразу. Благодарю Уважаемого Акима г Нур-Султан.",5
Отличное приложение! Очень удобно!,5
"Ввёл эцп без проблем, всё работает, очень доволен",5
Отличное приложение. Все работает. Только мало услуг еще,5
"Класс, спасибо за приложение. Очень удобное.",5
"Отличное приложение, удобно.",5
"Здрасти не могу проити регистрацию пишет ошибка в чем проблема,не принимает пароль?!",5
Быстро и очень удобно,5
Легко и удобно,5
"Удобно не выходя из дома, спасибо всем кто работает в этой области удачи в работе",5
Очень удобно всё под рукой ♠️😎🛡️🗡️⚔️🗡️🛡️😎♠️👍👍👍,5
"Очень удобно и быстро, спасибо",5
Отличное приложение. Удобно в использовании.,5
Молодцы постарались для народа очень удобно вытаскиваю все справки и не парюсь по цонам респект,5
"Вы умнички!!! Удачи!!! Приложение замечательное, и делает жизнь проще!!!",5
"оперативно получила запрашиваемую информацию, спасибо",5
Все быстро и не выходя из дома очень удобно. Спасибо вам за вашу работу 💐💐💐💐,5
Нормальное приложение. У меня с интернетом проблема. А так в общем то терпимо.,5
Нормальное приложение. Все легко и быстро,5
Быстро и удобно,5
Быстро и удобно,5
Очень удобное приложение👍 лично моё мнение. Твёрдая пятёрка.,5
"Удобно, то что надо! Все под рукой!",5
"Меняю свою оценку, так проблема устранена. Вопрос решили положительно. Спасибо! Удачи вам!",5
Отличное приложение. Очень удобно.,5
После обновлений работать стал хорошо,5
Ошибки удалили работает хорошо..,5
Добавьте возможность авторизации через нфс и удостоверения,5
"Приложение нужное, но не всегда работает.",5
Здравствуйте я не могу зайти в приложении через одноразовый пароль говорит что не зарегистрирован,5
Спасибо! удобно и легко к,5
"Все работает.И регистрация,и ЭЦП,и запись на вакцинацию даже прошла. Дайте время разработчикам,все отрегулируют на ""Ура"".Терпение,ребята.Все хорошо!",5
Раньше не выходя из дома .я могла узнавать гос очередь жилья.почему сейчас нету доступа.,5
Очень полезное и удобное приложение!,5
Всегда полезная и нужная информация,5
Очень удобный приложение советую всем использовать это приложения спасибо всем!),5
Не могу открыть приложение. Сбрасывает егов мобиле. Как войти?,5
Проблема решена! Обновились документы!,5
"Друзей найти тяжеловато возрастне подходит. Одна моложеж,пыталась",5
Все. складно. понятливо. в общем. удовлетворительно. удачи.,5
Быстро зарегистрировалась. Очень доступная программа,5
Классное и удобное приложение) не нужно никуда ходить,5
Отличное и удобное приложение,5
Не видит ключи 🔑 ЭЦП. Убили приложение!,5
"Очень удобно, молодцы!",5
Очень удобно и быстро,5
"Я приехала из Алматы и в Костанае подала заявление, чтобы из архива получить справку. На проходной и в последующем кабинете вежливо приняли заявление. Надеюсь на днях получу нужную мне справку. Обслуживание на должном уровне. Всем спасибо.",5
Приложение очень хорошее и полезное!,5
"Невозможно зарегистрироваться, как может быть не верный блин пароль?????????? Доделать приложение!",5
"Не чё так, дизайн классный.",5
на данный момент отличный функционал,5
Калабаев Нурлан: Хорошая вещь!!! Спасибо что разработали. Понятно и проста для использования!!,5
"Пытаюсь в мобильной версии получить одноразовый доступ, но пишит что не зарегистрирован в M-gov. Подскажите как и где это регистрироваться",5
Отличное приложение! Больше услуг нужно!,5
"Здравствуйте ведите функцию данных о диспансерских учётом наркологии,психиатрии,туберкулёзе и тд и ТП,а именно историю болезни диагноза и препаратов с самого детства чтоб лично пациен мог наблюдать кантролировать это учёт а не врачи что захотели там то и написали,вот у меня ситуация в детстве не правельно поставили на учёт стоял у Невропотолога по неврологическому деагнозу, патом его не стало поставили к психиатру, и теперь нету истории с детства чтоб доказать!!!",5
Быстро и грамотно,5
Отлично! Всё просто.,5
Спасибки всё очень доступно.Вы молодцы.Спасибо разработчикам.,5
Ну вот уже и прогресс настал в вашем приложении! Так держать!!,5
не работает программа отстой,5
"Все работает, ЭЦП все дела как положено, нужно чуть мозгами шевельнуть и все",5
Очень удобно много чего можно получать дома,5
Очень удобная программа!,5
удобно быстро комфортно,5
самый удобный и быстрый,5
"Помогли зделать регистрацию, сейчас всё доступно и понятно.",5
Немагу язык поменять в с английского на русский,5
После обновления не могу войти в приложение,5
Удобно и практично,5
Загрузила и установила без проблем.,5
"Отличное приложение, удобно",5
Классно и удобно использовать!,5
Спаравку открыть не могу. Документ стоит нно не открывается,5
Удобное приложение. Благодарю разработчиков.,5
"Наконец-то то будущее наступило! Илон Маск нервно курит в сторонке. За 5 минут без бюрократии, очередей и прочих негативных эмоций я получила справку в электронном виде и просто счастлива! Хвала прогрессу, надеюсь, скоро мы везде перейдём на это.",5
Очень удобное приложение! Рекомендую!,5
Очень удобная система,5
"Перезагрузил,всё заработало.",5
Приложение супер! Дорогие разработчики спасибо вам огромно ставлю 1000000 с любовью 💖,5
Легко и доступно,5
С новым обновлением исправили мою проблему. Спасибо!,5
Не могу авторизоваться.никак.все время идёт отказ.лохотрон.деньги содрали.и опять-таки обманули.,5
Спасибо всё заработало после того как удалил и снова загрузил,5
Приложение отличное для работы на сайте e-gov.kz.,5
"Удивительно, но все получилось с первого раза. Отправила заявку на очередь в садик. 2 часа мучилась с ЭЦП ключом полученным в ЦОН-е, но через qr код отправила за минуту",5
"Спасибо очень удобно,кезде можно ползоваться",5
Удобной приложение для устройства,5
Слишком много загрузки,5
Почему нету свидетельств о рождении детей. Либо я не нашол куда вы их спрятали. Спасибо за ответ,5
Мне нравиться это приложение спасибо разработчикам,5
это такой идеальная приложенич,5
Удобная и красивая программа,5
Приложение ЕГоф работает отлично спасибо большое за помощь,5
Очень удобное справки можно получить не ходя в Цон,5
Здравствуйте! Почему меню на английском...,5
"Все хорошо, спасибо, ничего не зависает",5
Удобно и не куда не надо ходить,5
легко зашел мне понравилось,5
Молодцы быстро и качественно,5
Удобное и понятное приложение,5
Очень иногда долго грузит,5
Это очень хорошо и удобно.6+,5
По мобильному приложение нормально не работает,5
"Здравствуйте. Сделайте возможность сразу получить 5 справок одним кликом( с тубдиспансера, наркологии, психоневрологического , о судимости , о административного правонарушения)",5
Вы че говорите( Очень отличная всё можно посмотреть👍👍👍,5
У меня егов не работает даже не могу за лигистрироватся не че8 не открывает,5
Очень удобная программа,5
Уа нет ни че как ну не,5
Очень удобное приложение. Спасибо разработчикам,5
Пишет что пароль неверный но я написала правильно сколько раз я обновиляла не получается,5
У меня примерно 2-3 минуты зависала но потом всё нормально. 5 баллов,5
Всё норм.без глюков.Сначало надо разобраться для чего именно она нужна.,5
Пока все устраевает. Хорошая идея. Водительское удостоверение не открывается,5
Приложение хорошо работает.,5
Молодцы приложение дотянули. Не останавливайтесь на достигнутом,5
"Удобнее пользоваться, чем на сайте сидеть с мобильного",5
Хочу сказать спасибо за ваше труд. Это сколько проделанных работ. Спасибо Вам за труд. Желаю удачи и процветания вашей команде. Так держать. Вы лучшие,5
Красатааа да и только удобство,5
Скачал. Зарегистрировался. Нашёл что нужно. Все работает спасибо,5
Супер приложения!!! Удобно!!!давно бы так))),5
Теперь понятно только немного разница с компьютерами там больше уведомлений чем здесь.а так нормально,5
"Спасибо,очень удобно всё сделали,молодцы горжусь вами!!!",5
Приятно работать с вежливым и знающим своей работы. Спасибо.,5
"Весьма удобное приложение, спасибо!",5
"Всем добрый день. Зарегистрировался за 5 минут. Как дальше будет, ещё не проверял.",5
Нормальное приложение зарегистрировался буквально за минуту.,5
Хорошая и полезная программа.,5
Все отлично работает.,5
"Супер, удобное приложение. 🤗",5
